{
  "plan_id": "plan_sample_1.0c_grow_os",
  "milestone": "1.0C",
  "source_goal": "Grow AI Company OS from an internal engineering factory into a multi-factory operating system that can plan product, media, sales, research, finance, customer success, and knowledge work.",
  "goal_type": "company_ops",
  "planning_mode": "static",
  "created_by_agent": "ceo_agent",
  "owner_approval_required": true,
  "dispatch_allowed": false,
  "dispatch_blocked_reason": "Router execution is blocked in planning-only phase 1.0C.",
  "safety_summary": "All operations configured in static planning mode. Live network and database side effects blocked.",
  "missions": [
    {
      "mission_id": "m01_audit",
      "title": "Initial Repository Audit",
      "mission_type": "REPO_AUDIT",
      "target_factory": "ai_dev_factory",
      "target_capability": "dev_repo_audit",
      "owner_agent": "cto_agent",
      "required_inputs": ["repo_path"],
      "expected_outputs": ["audit_report"],
      "safety_class": "safe_local",
      "blocked_actions": ["deploy_production", "read_secrets", "drop_database", "spend_ad_budget", "send_external_email", "auto_publish_content"],
      "approval_required_actions": ["code_merge_master"],
      "depends_on": [],
      "status": "ready_for_dry_run",
      "dispatch_allowed": false,
      "dispatch_blocked_reason": "Direct queue dispatch blocked. System is in planning-only mode.",
      "verifier_requirements": [],
      "handoff_target": "product_agent"
    },
    {
      "mission_id": "m02_product",
      "title": "Product Gap Research",
      "mission_type": "PRODUCT_RESEARCH",
      "target_factory": "research_factory",
      "target_capability": "product_research",
      "owner_agent": "research_agent",
      "required_inputs": ["feature_area"],
      "expected_outputs": ["feature_report"],
      "safety_class": "safe_local",
      "blocked_actions": ["deploy_production", "read_secrets", "drop_database", "spend_ad_budget", "send_external_email", "auto_publish_content"],
      "approval_required_actions": ["change_safety_limits"],
      "depends_on": ["m01_audit"],
      "status": "planned",
      "dispatch_allowed": false,
      "dispatch_blocked_reason": "Direct queue dispatch blocked. System is in planning-only mode.",
      "verifier_requirements": [],
      "handoff_target": "research_agent"
    },
    {
      "mission_id": "m03_market",
      "title": "OS Market Sizing Analysis",
      "mission_type": "MARKET_RESEARCH",
      "target_factory": "research_factory",
      "target_capability": "market_research",
      "owner_agent": "research_agent",
      "required_inputs": ["sector"],
      "expected_outputs": ["market_analysis_report"],
      "safety_class": "safe_local",
      "blocked_actions": ["deploy_production", "read_secrets", "drop_database", "spend_ad_budget", "send_external_email", "auto_publish_content"],
      "approval_required_actions": ["change_safety_limits"],
      "depends_on": ["m02_product"],
      "status": "planned",
      "dispatch_allowed": false,
      "dispatch_blocked_reason": "Direct queue dispatch blocked. System is in planning-only mode.",
      "verifier_requirements": [],
      "handoff_target": "cmo_agent"
    },
    {
      "mission_id": "m04_media",
      "title": "Marketing Launch Campaign Plan",
      "mission_type": "CONTENT_PLANNING",
      "target_factory": "media_factory",
      "target_capability": "media_content_strategy",
      "owner_agent": "cmo_agent",
      "required_inputs": ["target_audience", "topic"],
      "expected_outputs": ["content_calendar"],
      "safety_class": "safe_local",
      "blocked_actions": ["deploy_production", "read_secrets", "drop_database", "spend_ad_budget", "send_external_email", "auto_publish_content"],
      "approval_required_actions": ["change_safety_limits"],
      "depends_on": ["m03_market"],
      "status": "planned",
      "dispatch_allowed": false,
      "dispatch_blocked_reason": "Direct queue dispatch blocked. System is in planning-only mode.",
      "verifier_requirements": [],
      "handoff_target": "ceo_agent"
    },
    {
      "mission_id": "m05_sales",
      "title": "First Beta Lead Identification",
      "mission_type": "LEAD_RESEARCH",
      "target_factory": "sales_factory",
      "target_capability": "sales_lead_research",
      "owner_agent": "ceo_agent",
      "required_inputs": ["target_industry"],
      "expected_outputs": ["lead_report"],
      "safety_class": "safe_local",
      "blocked_actions": ["deploy_production", "read_secrets", "drop_database", "spend_ad_budget", "send_external_email", "auto_publish_content"],
      "approval_required_actions": ["change_safety_limits"],
      "depends_on": ["m04_media"],
      "status": "planned",
      "dispatch_allowed": false,
      "dispatch_blocked_reason": "Direct queue dispatch blocked. System is in planning-only mode.",
      "verifier_requirements": [],
      "handoff_target": "cfo_agent"
    },
    {
      "mission_id": "m06_finance",
      "title": "Maturity Cost Estimation",
      "mission_type": "PRICING_ANALYSIS",
      "target_factory": "finance_factory",
      "target_capability": "pricing_analysis",
      "owner_agent": "cfo_agent",
      "required_inputs": ["product_costs"],
      "expected_outputs": ["pricing_report"],
      "safety_class": "safe_local",
      "blocked_actions": ["deploy_production", "read_secrets", "drop_database", "spend_ad_budget", "send_external_email", "auto_publish_content"],
      "approval_required_actions": ["change_safety_limits"],
      "depends_on": ["m05_sales"],
      "status": "planned",
      "dispatch_allowed": false,
      "dispatch_blocked_reason": "Direct queue dispatch blocked. System is in planning-only mode.",
      "verifier_requirements": [],
      "handoff_target": "coo_agent"
    },
    {
      "mission_id": "m07_knowledge",
      "title": "Strategic Decision Logging Summary",
      "mission_type": "DOC_SUMMARY",
      "target_factory": "knowledge_factory",
      "target_capability": "internal_docs_summary",
      "owner_agent": "coo_agent",
      "required_inputs": ["doc_file"],
      "expected_outputs": ["doc_summary"],
      "safety_class": "safe_local",
      "blocked_actions": ["deploy_production", "read_secrets", "drop_database", "spend_ad_budget", "send_external_email", "auto_publish_content"],
      "approval_required_actions": ["change_safety_limits"],
      "depends_on": ["m06_finance"],
      "status": "planned",
      "dispatch_allowed": false,
      "dispatch_blocked_reason": "Direct queue dispatch blocked. System is in planning-only mode.",
      "verifier_requirements": [],
      "handoff_target": "cto_agent"
    },
    {
      "mission_id": "m08_verify",
      "title": "Milestone 1.0C Validation",
      "mission_type": "VERIFY_PHASE",
      "target_factory": "ai_dev_factory",
      "target_capability": "dev_self_test_verification",
      "owner_agent": "cto_agent",
      "required_inputs": ["phase_name"],
      "expected_outputs": ["self_test_report"],
      "safety_class": "safe_local",
      "blocked_actions": ["deploy_production", "read_secrets", "drop_database", "spend_ad_budget", "send_external_email", "auto_publish_content"],
      "approval_required_actions": ["code_merge_master"],
      "depends_on": ["m07_knowledge"],
      "status": "planned",
      "dispatch_allowed": false,
      "dispatch_blocked_reason": "Direct queue dispatch blocked. System is in planning-only mode.",
      "verifier_requirements": [],
      "handoff_target": "ceo_agent"
    }
  ]
}
